name,data
Aalborg University,"Aalborg University는 덴마크 북부 지역에 위치한 대학으로, 창의적인 학습 방법과 실전 중심의 교육 프로그램을 제공하는 대학이다."
American University,"미국의 워싱턴DC에 위치한 American University는 세계적인 국제관계 및 정치학 전공으로 유명하며, 활발한 국제적인 학술연구와 취업 기회를 제공합니다."
"American University (2017-2: WSP, 2018-1: AU Abroad)","미국 디시 지역에 위치한 아메리칸 대학으로, 국제적인 다양성과 높은 진학률을 자랑한다."
American University (WSP),"미국의 워싱턴 D.C. 중심가에 위치하며, 현대적인 시설과 교육 프로그램, 유연한 학위 옵션 및 다양한 문화 교류 활동을 제공하는 대학이다."
Aoyama Gakuin University,"Aoyama Gakuin University는 일본 도쿄에 위치하며, 교육과 연구에 대한 열정과 국제화, 인문학, 비즈니스 분야의 강점으로 유명합니다."
Arizona State University,"Arizona State University는 미국 애리조나에 위치하며, 규모와 다양성이 풍부한 공립 대학으로, 우수한 학사 프로그램과 창의적인 연구 기회를 제공합니다."
Arkansas State University,"아칸소우 주 존슨시티에 위치하며, 교육 및 연구 분야에서 규모와 수준이 높은 대학이다."
Aston University,"Aston 대학교는 영국 미드랜드 지역의 버밍엄에 위치하며, 비즈니스, 공학, 사회과학 분야에서 강력한 교육 및 연구 역량을 보유한 프리스티지 대학입니다."
Audencia Business School,"Audencia Business School은 프랑스 남서쪽에서 가장 중요한 도시인 Nantes에 위치한 국제적인 경영 대학이며, 지속 가능성, 산업 혁신 및 국제 비즈니스 분야에 대한 교육 교육과 연구에 대한 전문성을 전문으로 한 학교입니다."
Audencia Nantes School of Management,오드앙스 낭트 경영대학은 프랑스 낭트에 위치하며 국제적인 교육 방식과 산업계와 긴밀한 협력으로 세계적 수준의 경영 인재를 양성합니다.
Australia National University,"오스트레일리아 국립대학교는 캔버라에 위치해 있으며, 우수한 연구 능력과 국제적인 학술 활동을 펼치는 세계적인 대학이다."
Australian National University,"오스트레일리아 국립대학교는 캔버라에 위치한 세계적 수준의 대학으로 대학, 연구 및 지식 전달 분야에서 우수한 성과를 보유하고 있습니다."
Autonomous University of Barcelona,"스페인 카탈루냐 지역 바르셀로나에 위치하며, 스페인어, 카탈로니아어, 영어 등 다양한 언어로 수업을 진행하는 유럽 최고의 대학 중 하나이다."
Autonomous University of Madrid,Autonomous University of Madrid은 스페인 마드리드에 있는 자율 대학으로 교육과 과학 분야에서 저명합니다.
BEM Management School,"BEM Management School은 프랑스 파리에 위치한 경영 대학으로, 국제적인 교육, 취업 지원 및 산업계와의 협력을 강조하며 학생들의 창의성과 리더십을 발전시키는 데 초점을 둔다."
Beijing Institute of Technology,"베이징에 위치하며, 군사기술과 과학기술 분야에서 우수한 연구 및 교육 성과를 가진 대학."
Beijing Normal University,"베이징 노멀 대학교는 중국의 수도인 베이징에 위치하며, 교육과 thecnology 분야에서 국제적인 학술 연구 선도 대학 중 하나이다."
Berlin School of Economics,"베를린 경제 대학교는 독일 베를린에 위치하고 있으며, 경제, 경영, 관리, 회계, 인사관리 등과 관련된 교육과 연구를 주력으로 하는 대학교입니다."
Berlin School of Economics and Law,"베를린 경제 법학 대학은 베를린에 위치하며, 비즈니스 관련 전문 교육을 제공하는 특징이 있습니다."
Berlin School of Economics and Law Schoneberg Campus,베를린 경제법 대학교 쇼네베르크 캠퍼스는 도시 중심부에 위치하며 경제와 사법 분야에 특화된 학교입니다.
Berlin University of Applied Sciences and Technology,베를린 응용과학기술대학교는 도시 중심가에 위치하며 실용적인 과학기술교육과 산업협력에 중점을 둔 대학입니다.
Birmingham City University,"버밍엄 시티 대학교는 영국 버밍엄에 위치하며, 그녀의 전통적인 의무교육, 산업 연계 연구 및 다양한 국제적인 프로그램으로 유명합니다."
Boise State University,"보이시 주립 대학교는 아이다호주 보이시 시내에 위치하며, 야외 스포츠 시설, 예술 단체, 연구 및 교육 기회를 제공하는 대학교입니다."
Bordeaux ecole de management(현 Kedge business school),"보르도에 위치한 경영 전문 대학으로, 국제적으로 인정받는 전략, 인사관리, 마케팅 등의 교육 분야에서 우수한 평가를 받고 있습니다."
Bosphorus University,"보스포러스 대학교는 터키 이스탄불에 위치하며, 유럽과 아시아 대륙을 연결하는 보스포러스 해협을 바라보고 있는 세계적인 대학교입니다."
CBS International Business School,"CBS International Business School은 독일 프랑크푸르트에 위치하며, 국제적으로 인정받는 교육 프로그램과 강력한 취업 지원 시스템을 가진 비즈니스 학교입니다."
CLARKSON UNIVERSITY,클락슨 대학교는 미국 뉴욕 주 북부에 위치하며 공학 및 경영 분야에 강점이 있는 언더그래듣 대학교입니다.
Ca' Foscari University of Venice,"카 포스카리 베네치아 대학은 이탈리아 베네치아에 위치하며 인문과학, 경제 및 비즈니스 분야의 교육과 연구를 중점적으로 추구하는 선구적인 대학입니다."
California State University San Marcos,캘리포니아 주립 대학교 샌 마르코스 캠퍼스는 남쪽 캘리포니아에 위치하며 학생 중심의 학습 환경과 다양한 과목 제공으로 유명하다.
"California State University, Long Beach","캘리포니아 주립 대학교 롱비치 캠퍼스는 로스앤젤레스에서 남쪽으로 약 30분 떨어져 있으며, 바다와 인접한 캠퍼스로 해외 유학생들이 많이 찾는 대학교입니다."
Catholic University of Lille,"카톨릭 리옹 대학은 프랑스의 릴에 위치한 교육 및 연구를 위한 카톨릭 대학으로, 종교적인 가치를 기반으로 지식을 전달하며 사회에 기여합니다."
Catholic University of the Sacred Heart,"카톨릭 신생 대학은 이탈리아 밀라노에 위치하며, 교육, 연구, 사회발전을 위해 종교적 가치와 사랑의 정신을 중요시하는 대학이다."
Charles University,"체코 프라하에 위치하며, 세계에서 가장 오래된 대학 중 하나로 교육의 전통과 역사가 높은 대학이다."
Chemnitz University of Technology,켈른치 대학교는 독일의 동부 지역에 위치하며 과학과 공학 분야에서 선두적인 학술 역량을 보유하고 있습니다.
Chiba University,"일본의 도시인 Chiba에 위치해 있는 Chiba University는 대학원 캠퍼스와 산업대학원을 갖춘 국립 대학으로, 과학공학 분야에서 탁월한 교육과 연구를 진행하고 있다."
Chinese University of Hong Kong,"중국 홍콩 대학교는 중국 영토 내에 있으며, 교육 및 연구 분야에서 세계적인 평가를 받고 있는 대학이다."
Chuo University,"Chuo University는 일본 도쿄에 위치하며, 교육이론과 실무 등 다양한 분야에서 폭넓은 교육을 제공하는 대학입니다."
City University of Hong Kong,시티 유니버시티는 홍콩에 위치하며 교육 질이 높은 대학으로 유명합니다.
Clarkson Univeristy,"클락슨 대학교는 뉴욕 주 북쪽에 위치하며, 공학 분야에서 역량이 높은 프로그램을 갖춘 기술 중심 대학이다."
Clarkson University,클락슨 대학교는 뉴욕주 북부에 위치하며 공학 분야의 교육과 연구에 강점이 있는 대학교입니다.
College of Charleston,"컬리지 오브 찰스턴은 남쪽해안 풍경과 역사적인 건축물들로 인상적인 도시 찰스턴에 위치한 공립 대학으로, 교육적 혁신과 문화적 다양성을 추구하여 그 창의성과 열정적인 학생들로 유명합니다."
Columbia University,"컬럼비아 대학교는 뉴욕에 위치한 세계적인 거점 대학으로, 학문의 전반적인 분야에서 선두적인 위치를 갖추고 있습니다."
Copenhagen Business Academy,"코펜하겐 비즈니스 아카데미는 덴마크 코펜하겐에 위치하며, 학생 중심의 혁신적인 교육과 직업 준비에 중점을 두고 있습니다."
Copenhagen University College of Engineering,"코펜하겐 대학교 공과대학은 디자인, 캐드, 건축, 전기, 기계 등 다양한 분야에서 유능한 엔지니어를 양성하는 학교로, 덴마크 코펜하겐에 위치해 있다."
Czech Technical University in Prague,체코 기술대학 프라하 캠퍼스는 프라하 중심지에 위치하며 기술 및 공학 분야에서 국제적으로 선도하는 대학입니다.
Daito Bunka University,"다이토 분카 대학교는 일본 시부야시에 위치하며, 경영 및 디자인 관련 학과가 유명한 대학교이다."
ECOLE SUPERIEUR DE COMMERCE INTERNATIONAL DE PAS DE CALAIS,"ECOLE SUPERIEUR DE COMMERCE INTERNATIONAL DE PAS DE CALAIS는 프랑스의 팡드칼레 지역에 위치한 국제상업 전문 대학으로, 국제비지니스 및 글로벌 마케팅 분야에서 교육 프로그램을 제공합니다."
EDHEC Business School,"EDHEC Business School은 프랑스의 리옹과 남부 지역에 위치한 세계적인 경영대학으로, 글로벌 경영 교육과 혁신적인 연구에 특화되어 있습니다."
EPF School of Engineering,"EPF School of Engineering은 프랑스에서 파리와 리옹 중간지점인 사네(Saint-Etienne)에 위치한 공대로, 산업 디자인 분야에서 우수한 평판을 가지고 있습니다."
ESADE Business School,"ESADE Business School은 스페인 바르셀로나에 위치한 세계적으로 인정받는 경영 대학으로, 진보적인 경영교육과 국제적인 망을 가지고 있습니다."
Ecole de Management Leonard De Vinci,"Ecole de Management Leonard De Vinci는 파리 외곽의 라 드페갈(Râle Diètre)에 위치하며, 과학, 예술 및 경영 분야의 교육 프로그램을 제공합니다."
Edith Cowan University,"Edith Cowan University는 호주 서부 페스티벌시에서 위치하며, 교육과 연구에 중점을 둔 혁신적인 대학으로서 산업 협력 및 비즈니스 역량 강화에 초점을 두고 있다."
Elon University,"엘론 대학교는 북카롤라이나 주에 위치하며, 높은 학술적 수준과 국제화, 사회봉사 등을 강조하는 리버럴 아츠 대학이다."
Emlyon Business School,"Emlyon Business School은 프랑스 리옹에 위치한 세계적인 경영대학으로, 국제적인 학생들과 협업 프로그램을 제공하며 산업계와 긴밀한 파트너쉽을 갖고 있습니다."
Engineering College of Copenhagen,코펜하겐 공학 대학은 덴마크 코펜하겐에 위치하며 혁신적이고 실용적인 공학 교육과 연구를 중심으로 합니다.
Enhancing Science Courses by Integrating Python,"""파이썬을 통합하여 과학 과목을 향상시키는 방법으로 사용되며, 웹 기반 인터페이스와 시각화 기능이 강점이다."""
Erasmus University Rotterdam,"에라스무스 대학교는 네덜란드의 로테르담에 위치한 대학으로 경영학, 경제학, 의학 분야에서 세계적인 평판을 가지고 있습니다."
European University of Madrid,"유럽 대학교는 마드리드에 위치하며 국제적인 교육과 연구, 혁신적인 교육 방법 등을 특징으로 갖는 대학이다."
FH Campus Wien,"FH Campus Wien은 오스트리아 비엔나에 위치한 실용대학으로, 산업 관련 전공 분야를 강점으로 하는 학교입니다."
FH Kufstein,FH Kufstein은 오스트리아의 쿠프슈타인에 위치한 경영학과 관광학을 중심으로 한 유능한 대학이다.
FHWien of WKW,"FHWien of WKW는 오스트리아의 수도인 비엔나에 위치한 비즈니스 및 관리 관련 대학으로, 실무 중심의 교육과 산업체 중심의 연구를 바탕으로 새로운 비즈니스 모델을 연구합니다."
Fachhochschule Worms University of Applied Sciences,"독일 바덴-바덴주에 위치한 직업 대학으로, 경제, 관광, 호텔 매니지먼트 등 분야에서 교육 및 연구를 수행한다."
"Faculty of Economics and Business, University of Zagreb","자그레브 대학교 경제경영학부는 자그레브 시내에 위치하며, 경제 및 비즈니스 관련 다양한 학과가 있다."
Fairleigh Dickinson University,"Fairleigh Dickinson University는 미국 뉴저지 주에 위치하며, 국제 학생들을 위한 학교로 전 세계에서 다양한 문화를 경험할 수 있는 교육을 제공합니다."
Fairleigh Dickinson University (Vancouver Campus),페어리 딕킨슨 대학교 밴쿠버 캠퍼스는 캐나다 브리티시컬럼비아주에 위치하며 국제적인 학생들과 다양한 전공 프로그램을 제공하는 대학입니다.
Florida Gulf Coast University,"플로리다 주 서부에 위치하며, 해변가가 인기 있는 캠퍼스로 유명한 대학입니다."
Florida International University,플로리다 국제 대학교는 마이애미의 중심에 위치하며 국제 교육과 연구를 중요시하는 대학으로 유명합니다.
Florida State University,"Florida State University는 미국 플로리다 주 탤러하시(Tallahassee)에 위치하며, 우수한 교육과 연구에 중점을 둔 대표적인 공립 대학교이다."
Fontys University of Applied Sciences,"Fontys 대학은 네덜란드에 위치한 응용 과학 대학으로, 캠퍼스는 에인트호번, 힐베르슘, 베넨드레흐트, 테일버그 및 베노오이스 등 다양한 도시에 분포되어 있습니다."
Fontys University of Applied Sciences (Eindhoven),"폰티스 응용 과학 대학교는 에인트호벤에 위치하며, 혁신적이고 실용적인 교육과 산업 협력을 강조하여 학생들의 실무 능력을 키우는 대학입니다."
Fontys University of Applied Sciences (Tilburg),"Fontys University of Applied Sciences는 네덜란드 Tilburg에 위치하며, 학사와 직업교육 학위 과정을 제공하는 대학입니다."
Fontys University of Applied Sciences (Venlo),"Fontys University of Applied Sciences (Venlo)는 네덜란드의 Venlo에 위치한 응용 과학 대학으로, 가장 효과적인 학습 경험을 제공합니다."
Fontys university of applied science,"Fontys대학교는 네덜란드에 위치한 응용과학 대학으로, 현실적인 배움과 직장에서 요구하는 기술, 지식, 사고 방식을 중심으로 교육하며, 실제 현업과의 연계를 강조합니다."
Frankfurt School of Finance & Management,"Frankfurt School of Finance & Management은 독일 프랑크푸르트에 위치한 금융 및 경영 교육 전문 대학으로, 유럽을 대표하는 금융 교육기관 중 하나이며 창의적이고 혁신적인 교육을 추구합니다."
Frankfurt University of Applied Sciences,프랑크푸르트 응용 과학 대학은 독일 프랑크푸르트에 위치하며 실용적인 교육과 혁신적인 연구 중심 대학입니다.
Frankfurt school of finance & management,"프랑크푸르트 금융 경영 대학은 독일 프랑크푸르트에 위치한 금융, 경영 분야 전문 대학으로 유럽에서 유수한 대학으로 꼽힘."
Fudan University,"위치는 중국 상하이에 있으며, 국내외에서 가장 명성 높은 대학 중 하나로, 과학기술, 언어, 경제 등 다양한 분야에서 석·박사 교육에 강점이 있는 대학입니다."
Fulda University of Applied Sciences,풀다 응용 과학 대학교는 독일 헤센주에 위치하며 실용적인 교육과 산업과의 긴밀한 협력으로 학생들의 미래 진로를 성장시키는 대학교입니다.
Furtwangen University,"Furtwangen 대학은 독일 남서에 위치한 혁신적인 공과대학으로, 공학, 정보기술 등 분야에서 혁신적인 연구와 교육을 진행하고 있습니다."
George Washington University,"조지 워싱턴 대학교는 워싱턴 D.C.에 위치하여 정치, 국제, 경영 등 다양한 분야에서 깊은 전문성과 글로벌 시각을 가진 교육을 제공하는 명문 대학입니다."
Grenoble Alpes University,"Grenoble Alpes University(그르노블 알프 대학교)는 프랑스 남동부의 그르노블(대륙성 알프스 지역)에 위치하며, 과학 및 기술 분야에서 세계적으로 뛰어난 연구를 수행하는 대학으로 유명하다."
HEC Montreal,"HEC Montreal은 캐나다의 몬트리올에 위치한 경영대학으로 프랑스어로 강의가 진행되며, 글로벌 경영전문가들을 배출하는 국제적인 학교입니다."
HU University of Applied Sciences Utrecht,"HU University of Applied Sciences Utrecht는 네덜란드의 중심지 중 하나인 Utrecht에 위치하며, 혁신적인 교육 방식과 산업과의 협력을 강조하는 대학입니다."
Haaga-Helia University of Applied Sciences,핀란드의 주요 경영학교인 Haaga-Helia 대학은 학생 중심의 교육과 직무 중심의 교육방식으로 유명하며 핀란드의 수도 헬싱키에 위치해 있다.
HafenCity University Hamburg,"하펜시티 대학은 독일 함부르크에 위치한 도시재생 및 도시관리 전공의 대학으로, 유럽 최대의 도시재생 사업인 하펜시티 지구내에 위치해 있다."
Hague University of Applied Sciences,헤이그 응용 과학 대학은 네덜란드 헤이그에 위치하며 국제적인 분위기에서 현실적인 교육과 함께 창의성과 혁신을 중시하는 대학입니다.
Halmstad University,"스웨덴 남부 지역의 해변 도시에 위치한 Halmstad University는 스웨덴에서 가장 발전된 대학 중 하나로, 국제적인 학생들을 유치하며 현지 산업과 연계하여 경영, 공학, 인문 등 다양한 분야에서 교육 및 연구를 이끌어내고 있다."
Hanze University of Applied Sciences,Hanze University of Applied Sciences는 네덜란드 그론잔(Groningen)에 위치한 선진적인 공대 교육을 제공하는 대학입니다.
Hawaii Pacific Univeristy,"하와이 태평양 대학교는 하와이 주에 위치하며, 다양한 국적의 학생들이 다니며 국제적인 분위기를 자랑한다."
Hawaii Pacific University,하와이 태평양 대학교는 하와이에 위치하며 해외 유학 경험을 제공하는 국제적인 대학이다.
Heidelberg University,"하이델베르크 대학교는 독일의 바덴-뷔르템베르크 주에 있는 역사적인 대학으로, 세계적인 연구 및 교육의 중심지입니다."
Higher School of Economics,러시아의 모스크바에 위치한 고등 교육 기관으로 경제학 및 사회과학 분야에서 세계적인 평가를 받는 대학입니다.
Higher Technical School of Architecture of Madrid,"마드리드 고등 기술 건축학교는 마드리드에 위치하며, 고급 건축 학위를 제공하는 선도적인 교육 기관입니다."
Hitotsubashi University,"일본 도쿄에 위치한 초교류 대학으로 경제학, 경영학 분야에서 세계적인 평가를 받는다."
Hochschule Furtwangen University,Hochschule Furtwangen University는 독일의 남서부에 위치하며 공학 및 경영 분야를 중점적으로 교육하고 있습니다.
Hochschule Osnabrueck,"독일의 Hochschule Osnabrueck은 도시 중심부에 위치하며 기술, 경영, 예술 등 다양한 학과와 국제 교환 프로그램을 지원하는 대학입니다."
Hof University,"독일 바이에른주 Hof에 위치한 대학으로, 공학과 경영학을 중심으로 교육과 연구를 수행하며 산업계와 긴밀한 협력을 맺고 있다."
Hokkaido University,"Hokkaido University는 일본의 북부에 위치하며, 일본 최초의 대학인 만큼 긴 역사와 세계적인 학술적 수준을 갖춘 대학이다."
Hong Kong Baptist University,홍콩에 위치하며 기독교 정신을 바탕으로 친환경적이고 교육적인 환경을 제공하는 대학입니다.
Hong Kong University of Science and Technology,"홍콩 과학기술대학은 홍콩에 위치하며, 전문적이고 기술 중심적인 교육과 연구를 수행하는 대학입니다."
Hongkong University of Science and Technology(HKUST),"홍콩과 근접한 신도시인 클리어 워터 베이에 위치하며, 대학 랭킹에서 국제적으로 상위권을 차지하는 공과대학으로서 과학과 기술 분야에서 높은 국제적 평가를 받고 있음."
Huazhong University of Science and Technology,"중국의 후베이성에 위치한 대학으로, 과학기술 분야에서 전국적인 명성을 가진 공립 대학이다."
ICHEC Brussels Management School,"ICHEC Brussels Management School은 벨기에 브뤼셀에 위치하며, 경영 분야에서 유럽 내 최고 수준의 교육과 연구를 제공하는 학교입니다."
ICN Business School,"ICN Business School은 프랑스 남부 지역에 위치하며, 국제적인 학문적 환경과 산업계와의 긴밀한 협력 관계를 가지고 있습니다."
IE University,"IE 대학교는 스페인 마드리드와 세고비아에 위치한 국제적인 대학교로서, 이론과 현실을 결합한 교육프로그램과 다양한 전공분야와 유학 경험을 제공합니다."
IESEG School of Management,"IESEG School of Management은 프랑스 파리 근교의 라일-안틸리에에 위치한 세계적 수준의 경영 대학교로, 국제적인 교육 방식과 업계와의 긴밀한 협력을 바탕으로 깊은 전문 지식과 리더십 능력을 갖춘 비즈니스 리더를 양성합니다."
INSEEC (ECE LYON),"INSEEC (ECE LYON)은 프랑스 리옹에 위치한 선도적인 경영대학으로, 국제적인 교육환경과 산업계와의 강력한 네트워크를 가진다."
INSEEC BUSINESS SCHOOL,"INSEEC BUSINESS SCHOOL은 프랑스와 모나코에 위치하며, 나아가 국제적인 전문 경영 대학교로 인정받는다."
INSEEC Business School,"INSEEC Business School은 프랑스의 보르도, 판테르누-아도르, 리옹, 파리에 위치한 비즈니스 스쿨로, 국제적인 교육과 경험을 제공합니다."
INSEEC Business School (Bordeaux),"INSEEC Business School (보르도)는 프랑스 보르도에 위치한 세계적인 경영학교로, 높은 교육 수준과 취업 기회를 제공합니다."
INSEEC Business School (Paris),"INSEEC Business School (Paris)은 파리에 위치한 비즈니스 스쿨으로, 비즈니스 분야에서 광범위한 교육과 취업 기회를 제공한다."
ISCID-CO,"ISCID-CO는 인도네시아의 자바 섬 중심부에 위치하며, 사무실 내에 연구소를 갖추고 인공지능 분야의 연구 개발을 주로 수행하는 조직입니다."
Indiana University,"인디애나 대학교는 미국 인디애나주에 위치하며, 미국 최대의 규모를 자랑하는 사립 대학 중 하나이며 연구 중심의 교육 철학을 가지고 있다."
Indiana University Bloomington,"인디애나 대학교 블루밍턴 캠퍼스는 미국 인디애나주에 위치하며, 역사와 예술, 경영, 공학 등 다양한 분야의 교육을 제공하는 대학으로 유명하다."
"Indiana University, Kelley School of Business",인디애나 대학교 켈리 경영대학은 미국 인디애나주에 위치하며 경영분야에서 세계적인 명성과 평판을 가진 대학입니다.
Inholland University applied science,"인홀랜드 대학은 네덜란드에 위치한 응용과학 대학으로, 실질적이고 사례 중심의 교육, 실제 세계적인 문제에 대한 협력적 연구, 지속 가능한 개방적 공동체에 집중하며, 학생들이 실제 산업에서 경험을 쌓을 수 있는 역량 기반 교육을 제공합니다."
Inholland University of Applied Sciences,"인홀란드 응용과학대학교는 네덜란드 남서부 지역에 위치하며, 적극적인 실습 경험과 산업협력으로 학생들의 미래 진로에 도움을 주는 대학입니다."
Institut national des langues et civilisations orientales,"Institut national des langues et civilisations orientales은 파리에 위치하며, 아시아와 아프리카의 언어와 문명을 연구하는 국립 대학이다."
Institut superieur du commerce de Paris,파리에 위치한 경영대학으로 유럽 내 최고 수준의 경영교육을 제공한다.
Irkutsk National Research Technical University,이르쿠츠크 국립공과대학교는 시베리아에 위치하며 고급공대로 잘 알려져 있다.
Jean Moulin University Lyon 3,"장 무랭 리옹 3 대학은 프랑스 리옹에 위치하며 인문학, 법학, 경영학 등의 교육 분야에서 강점을 가지고 있습니다."
Jilin University,"지린 대학교는 중국 최초의 천체 물리학 전공을 갖춘 국립 대학교로, 중국의 주요 대학교 중 하나로 지리적으로 동북 지방에 위치한다."
KEDGE Business School,KEDGE Business School은 프랑스의 보르도와 마르세유에 위치하며 국제적인 시각과 현실적인 문제해결 능력을 갖춘 인재를 양성하는 경영대학교이다.
KIMEP,"KIMEP은 카자흐스탄 알마티에 위치한 국제적인 대학으로, 위대하고 독립적인 교육을 제공하며 카자흐스탄과 중앙아시아에서 가장 혁신적인 대학 중 하나이다."
