name,data
Waseda University,"일본 도쿄에 위치한 와세다 대학교는 교육, 연구 및 국제 교류 분야에서 세계적인 명성을 자랑하는 일본 최고의 종합 대학교입니다."
Washington State University,"워싱턴 주립 대학교는 미국 워싱턴 주에 위치하며, 전공 분야별로 우수한 교육 프로그램과 연구 시설을 보유한 국제적인 대학이다."
Western Illinois University,"위치는 일리노이 주의 맥컴버 지역에 있고, 미국 중서부에서 유일한 양대 국립 연구대학교로서 교육, 연구, 지역사회발전에 힘을 쏟고 있습니다."
Worms University of Applied Sciences,"Worms University of Applied Sciences(웜스 응용 과학대학)는 독일 남서부 롯마인주의 매력적인 중세 도시인 웜스(Worms)에 위치하며, 실용적인 교육과 산학협력을 강조하는 대학입니다."
Xi'an Jiaotong University,"중국의 서북쪽에 위치한 Xi'an Jiaotong University는 중국에서 고대 역사와 문화 유적지가 대표적이며, 교통, 공학, 의학 등 전공 분야에서 국내외적으로 높은 평가를 받는 대학입니다."
York St John University,"York St John University는 유네스코 세계 유산 도시인 York에 위치한 작고 아늑한 대학으로, 학생 중심의 교육과 개별적인 지도가 특징입니다."
York University,"York University는 캐나다 온타리오 주 토론토에 위치한 대학으로, 다양한 전공과 연구분야, 국제적인 학생들, 그리고 사회적으로 영향력 있는 프로그램을 갖추고 있다."
Zagreb School of Economics and Management,"Zagreb School of Economics and Management은 크로아티아의 수도인 자그레브에 위치한 경영대학교로, 국제적으로 인정받는 뛰어난 교수진과 혁신적인 교육 방식으로 경제와 관리 분야에서 선도적 역할을 하고 있습니다."
Zagreb school of economics and management,"자그레브 경제경영학교는 크로아티아 자그레브에 위치하며, 국제적인 학술 연구와 혁신적인 교육 방식으로 유명합니다."
Zurich University of Applied Sciences,스위스 취리히에 위치하고 산업 협력과 응용과학 분야에서 학문적 능력을 갖춘 대학입니다.
École centrale d'électronique,"에콜 센트랄 드 일렉트로니크는 프랑스 파리에 위치한 공학전문대학으로, 전자공학 및 IT분야에 대한 교육 및 연구를 수행하는 세계적인 대학입니다."
